video_url,user_url,username,title,view_num,created_at,shortdesc,collected_at
/watch?v=TjybYG8BBK0&pp=ygUacHJlc2lkZW50YWwgZWxlY3Rpb24gdHJ1bXA%3D,/@ABCNews,ABC News,Donald Trump announces 2024 presidential campaign,103K,1 year,Former President Donald Trump's announcement comes a week after the GOP underperformed in the midterm elections. WATCH ...,2024-01-26 05:19:23.147461
/watch?v=9zwy05u6ncg&pp=ygUacHJlc2lkZW50YWwgZWxlY3Rpb24gdHJ1bXA%3D,/@DonaldJTrumpforPresident,Donald J Trump,Make America Great For Us Again!,325K,8 months,New Ad Make America Great For Us Again! Check out our ad! VOLUNTEER: www.DonaldJTrump.com/JOIN Text TRUMP to ...,2024-01-26 05:19:29.453352
/watch?v=ML5hpoTifWg&pp=ygUacHJlc2lkZW50YWwgZWxlY3Rpb24gdHJ1bXA%3D,/@SkyNewsAustralia,Sky News Australia,Donald Trump predicted to win 2024 US presidential election,29K,10 days,Nationals Senator Matt Canavan has predicted Donald Trump will win the 2024 US presidential election. “Although I suppose the ...,2024-01-26 05:19:29.457260
/watch?v=bHBZaPGBaQ0&pp=ygUacHJlc2lkZW50YWwgZWxlY3Rpb24gdHJ1bXA%3D,/@CNN,CNN,'Absolutely unprecedented': George Conway weighs in on Trump in 2024 election,527K,3 days,Conservative lawyer George Conway discusses the number of legal cases former President Trump is facing as the 2024 ...,2024-01-26 05:19:29.460413
/watch?v=BRcxHNtY5X0&pp=ygUacHJlc2lkZW50YWwgZWxlY3Rpb24gdHJ1bXA%3D,/@NBCNews,NBC News,Trump holds first 2024 presidential campaign rally in Texas,238K,10 months,"Former President Donald Trump held the first formal rally of his 2024 presidential campaign in Waco, Texas as multiple federal ...",2024-01-26 05:19:29.464653
/watch?v=rmBG0TjgAIk&pp=ygUacHJlc2lkZW50YWwgZWxlY3Rpb24gdHJ1bXA%3D,/@markets,Bloomberg Television,Flashback: Donald Trump Wins the Presidency,135K,3 years,"Nov. 9, 2016 -- Bloomberg's Megan Murphy, Guy Johnson and Jonathan Ferro report on the moment Donald Trump clinched the ...",2024-01-26 05:19:29.467548
/shorts/thit--jp4fc,/@GuardianAustralia,Guardian Australia,Donald Trump announces 2024 presidential bid,341K,1 year,"Donald Trump, the former US President, announced his intention to run in the 2024 presidential election. Subscribe to Guardian ...",2024-01-26 05:19:29.470500
/watch?v=r6FcjPTHK90&pp=ygUacHJlc2lkZW50YWwgZWxlY3Rpb24gdHJ1bXA%3D,/@ABCNews,ABC News,Former President Trump leading polls ahead of Republican primaries,51K,3 weeks,"Donald Trump is dominating the polls ahead of the Iowa caucuses, with a new 538 poll showing him more than 30 points ahead of ...",2024-01-26 05:19:29.473604
/shorts/7T7f610WLz4,/@CNN,CNN,Trump dominates in stunning new poll,1.2M,5 months,Former President Donald Trump is leading GOP presidential candidate Gov. Ron DeSantis by a large margin in a New York ...,2024-01-26 05:19:29.476974
/watch?v=RkPb5x070eI&pp=ygUacHJlc2lkZW50YWwgZWxlY3Rpb24gdHJ1bXA%3D,/@CBSNews,CBS News,Sen. Tim Scott endorsing Donald Trump for 2024 presidential election,153K,6 days,"South Carolina Senator Tim Scott is endorsing former President Donald Trump in the 2024 GOP presidential race, multiple ...",2024-01-26 05:19:29.480981
/watch?v=UOP3EbiiD4U&pp=ygUacHJlc2lkZW50YWwgZWxlY3Rpb24gdHJ1bXA%3D,/@cbsboston,CBS Boston,Donald Trump speaks after winning NH primary,45K,2 days,Donald Trump spoke to supporters after defeating Nikki Haley in the New Hampshire primary.,2024-01-26 05:19:29.483504
/watch?v=Qsvy10D5rtc&pp=ygUacHJlc2lkZW50YWwgZWxlY3Rpb24gdHJ1bXA%3D,/@ABCNews,ABC News,Donald Trump VICTORY SPEECH | Full Speech as President Elect of the United States,7.4M,7 years,Donald J. Trump Full Victory Speech after becoming the President-elect of the United States. Trump addressed supporters as the ...,2024-01-26 05:19:29.486245
/watch?v=-INC9ncqwjc&pp=ygUacHJlc2lkZW50YWwgZWxlY3Rpb24gdHJ1bXA%3D,/@WHAS11News,WHAS11,Donald Trump responds after Ron DeSantis drops out of presidential race,91K,3 days,"DeSantis ultimately decided that he needed to endorse Trump given his popularity in the party, despite the deeply personal feud ...",2024-01-26 05:19:29.488915
/watch?v=W4Zd6L6-D8Y&pp=ygUacHJlc2lkZW50YWwgZWxlY3Rpb24gdHJ1bXA%3D,/@WVECTelevisionInc,13News Now,What Trump's primary win in New Hampshire means for presidential race,61K,1 day,"Former president Donald Trump defeated Nikki Haley in the GOP Primary in New Hampshire on Tuesday. Now, it's looking more ...",2024-01-26 05:19:29.491410
/watch?v=lfr1CZmmrOU&pp=ygUacHJlc2lkZW50YWwgZWxlY3Rpb24gdHJ1bXA%3D,/@ForbesBreakingNews,Forbes Breaking News,BREAKING NEWS: Donald Trump Reacts To Ron DeSantis Dropping Out Of The Presidential Race,372K,4 days,Former President Donald Trump spoke at a campaign event on Sunday about Florida Gov. Ron DeSantis (R) ending his ...,2024-01-26 05:19:29.494510
/watch?v=dJ87PuCecT4&pp=ygUacHJlc2lkZW50YWwgZWxlY3Rpb24gdHJ1bXA%3D,/@markets,Bloomberg Television,"Kevin McCarthy on Trump, Border Security, 2024 Election",5.9K,1 day,Former House Speaker Kevin McCarthy discusses the potential rematch of Joe Biden and Donald Trump in the 2024 presidential ...,2024-01-26 05:19:29.498904
/watch?v=eaK6n8YaA_Q&pp=ygUacHJlc2lkZW50YWwgZWxlY3Rpb24gdHJ1bXA%3D,/@NBCNews,NBC News,Full Panel: Trump could win 2024 election ‘by subtraction’,99K,4 months,"Cornell Belcher, Mark Murray, Danielle Pletka and Amy Walter join the Meet the Press roundtable to discuss 2024 polling, Biden's ...",2024-01-26 05:19:29.501851
/watch?v=v5Jgm09vwxg&pp=ygUbcHJlc2lkZW50aWFsIGVsZWN0aW9uIHRydW1w,/@KTVUFox2,KTVU FOX 2 San Francisco,Biden vs. Trump round two: 2024's potential rematch,514K,1 day,Biden's campaign said their focus will shift to draw contrast between the president and former President Trump as they gear up for ...,2024-01-26 05:19:36.640283
/watch?v=58SZ3_CAh4c&pp=ygUbcHJlc2lkZW50aWFsIGVsZWN0aW9uIHRydW1w,/@KCENNews,KCENNews,"Election 2024: Trump wins New Hampshire primary, moves closer to Biden rematch",72K,1 day,Biden beat his Democratic challengers in New Hampshire as a write-in candidate. SUBSCRIBE | http://bit.ly/2Z6mT7N Follow 6 ...,2024-01-26 05:19:36.643955
/watch?v=BlRN_kUlkt0&pp=ygUbcHJlc2lkZW50aWFsIGVsZWN0aW9uIHRydW1w,/@guardiannews,Guardian News,Trump wins in Iowa as Republican contest kicks off 2024 presidential race,10K,9 days,"The result for Trump was called quickly, while the battle for second place took much longer, with Ron DeSantis edging out Nikki ...",2024-01-26 05:19:36.647622
/watch?v=P4-VCGZf0pU&pp=ygUbcHJlc2lkZW50aWFsIGVsZWN0aW9uIHRydW1w,/@SkyNewsAustralia,Sky News Australia,Donald Trump predicted to win 2024 presidential election,31K,1 month,Liberal Senator Alex Antic has predicted Donald Trump will win the 2024 presidential election. “My prediction is … Donald Trump ...,2024-01-26 05:19:36.651017
/watch?v=WIg4w5cbykM&pp=ygUbcHJlc2lkZW50aWFsIGVsZWN0aW9uIHRydW1w,/@WPRI,WPRI,"Ron DeSantis drops out of 2024 presidential race, endorses Donald Trump",24K,4 days,"Florida Gov. Ron DeSantis suspended his Republican presidential campaign on Sunday, ending his 2024 White House bid just ...",2024-01-26 05:19:36.654227
/watch?v=Cdg6_gGvdEY&pp=ygUbcHJlc2lkZW50aWFsIGVsZWN0aW9uIHRydW1w,/@ForbesBreakingNews,Forbes Breaking News,BREAKING NEWS: DeSantis Drops Out Of Presidential Race And Endorses Trump,895K,4 days,"In a video released to social media, Gov. Ron DeSantis (R-FL) announced he is ending his 2024 presidential campaign, and ...",2024-01-26 05:19:36.657483
/watch?v=C-kah_T5wIo&pp=ygUbcHJlc2lkZW50aWFsIGVsZWN0aW9uIHRydW1w,/@Foxla,FOX 11 Los Angeles,"Ron DeSantis ends 2024 presidential campaign, endorses Trump",20K,4 days,Florida Gov. Ron DeSantis is ending his campaign for president. DeSantis made the announcement just days before the New ...,2024-01-26 05:19:36.665006
/watch?v=uLfuJ8cyrvs&pp=ygUbcHJlc2lkZW50aWFsIGVsZWN0aW9uIHRydW1w,/@WION,WION,US: Donald Trump mocks Nikki Haley’s first name | US Presidential Election 2024 | WION News,21K,5 days,Donald Trump used his social media platform Friday to mock Nikki Haley's birth name. The attack comes four days before the New ...,2024-01-26 05:19:36.668121
/watch?v=saZfcclFdIA&pp=ygUbcHJlc2lkZW50aWFsIGVsZWN0aW9uIHRydW1w,/@globalnews,Global News,"Ron DeSantis drops out of US presidential race, endorses Donald Trump",73K,4 days,"The Republican race to the White House has effectively become a two-person race, after Florida Gov. Ron DeSantis suspended ...",2024-01-26 05:19:36.671369
/watch?v=RO-LR_fEwfQ&pp=ygUbcHJlc2lkZW50aWFsIGVsZWN0aW9uIHRydW1w,/@VOANews,Voice of America,"Donald Trump Wins Presidential Election, Sending Shockwaves Around the World",659K,7 years,"In one of the greatest political upsets in U.S. political history, Republican Donald Trump defeated Democrat Hillary Clinton early ...",2024-01-26 05:19:36.674602
/watch?v=_gYeJq2Ha5o&pp=ygUbcHJlc2lkZW50aWFsIGVsZWN0aW9uIHRydW1w,/@ABCNewsIndepth,ABC News In-depth,Trump one step closer to being Republican Party's nominee in 2024 election | 7.30,17K,9 days,"He faces 91 felony counts, but that didn't stop Donald Trump from winning the first Republican presidential contest. The former ...",2024-01-26 05:19:36.678059
/watch?v=ME1_Fv7Qq50&pp=ygUbcHJlc2lkZW50aWFsIGVsZWN0aW9uIHRydW1w,/@fox5ny,FOX 5 New York,New Hampshire primary: Voting begins,97K,2 days,Just two candidates remain for the Republican presidential nomination – former President Donald Trump and former South ...,2024-01-26 05:19:36.681957
/watch?v=o7DKpzErjaA&pp=ygUbcHJlc2lkZW50aWFsIGVsZWN0aW9uIHRydW1w,/@NBCNews,NBC News,"Ron DeSantis drops out of 2024 presidential race, endorses Trump",73K,4 days,"In a video posted on the platform X, Florida Gov. Ron DeSantis announced that he was dropping out of the 2024 race for president ...",2024-01-26 05:19:36.685752
/watch?v=dYX4w41S0Us&pp=ygUbcHJlc2lkZW50aWFsIGVsZWN0aW9uIHRydW1w,/@msnbc,MSNBC,Trump vows to stay in 2024 presidential race,34K,5 months,"MSNBC delivers breaking news, in-depth analysis of politics headlines, as well as commentary and informed perspectives.",2024-01-26 05:19:36.689326
/shorts/25PsKZJhrqk,/@NBCNews,NBC News,"Vivek Ramaswamy drops out of 2024 presidential race, endorses Trump",215K,9 days,Vivek #Ramaswamy is dropping out of the 2024 presidential race after finishing outside of the top three in the #Iowa caucuses.,2024-01-26 05:19:36.692624
/watch?v=fZO1pmvJvlw&pp=ygUbcHJlc2lkZW50aWFsIGVsZWN0aW9uIHRydW1w,/@KTVUFox2,KTVU FOX 2 San Francisco,Trump wins New Hampshire primary,106K,2 days,Former President Donald Trump has won the New Hampshire Republican primary against former South Carolina Gov.,2024-01-26 05:19:36.695837
/watch?v=yW6il85qLF8&pp=ygUbcHJlc2lkZW50aWFsIGVsZWN0aW9uIHRydW1w,/@msnbc,MSNBC,'The most important question of the 2024 election': Accountability for Trump remains a wild card,111K,5 days,"Andrew Weissmann, former federal prosecutor and co-host of the ""Prosecuting Donald Trump"" podcast, and Katie Benner, ...",2024-01-26 05:19:36.699352
/watch?v=9TeYOZWGu8s&pp=ygUbcHJlc2lkZW50aWFsIGVsZWN0aW9uIHRydW1w,/@CSPAN,C-SPAN,Former President Trump Announces 2024 Presidential Campaign,98K,1 year,"Former President Trump: ""In order to make America great and glorious again, I am tonight announcing my candidacy for president ...",2024-01-26 05:19:36.702058
/watch?v=g9VHmAel_PQ&pp=ygUbcHJlc2lkZW50aWFsIGVsZWN0aW9uIHRydW1w,/@CNN,CNN,Why Nikki Haley would endorse Trump if she drops out from 2024 race,149K,2 days,Republican presidential candidate Nikki Haley sits down with CNN's Dana Bash to discuss the New Hampshire primary and what ...,2024-01-26 05:19:36.706139
/watch?v=zztcu8IIM_M&pp=ygUbcHJlc2lkZW50aWFsIGVsZWN0aW9uIHRydW1w,/@SkyNews,Sky News,US election 2024: All eyes on New Hampshire as Haley chases Trump,9.2K,2 days,Voting is underway in the New Hampshire primary as former UN envoy Nikki Haley aims to become the Republican nominee for ...,2024-01-26 05:19:36.715408
/watch?v=BqcImx-1jqk&pp=ygUbcHJlc2lkZW50aWFsIGVsZWN0aW9uIHRydW1w,/@ABCNews,ABC News,"Republican nomination for president comes down to Donald Trump, Nikki Haley",32K,3 days,ABC News Senior Congressional Correspondent Rachel Scott and ABC News Chief Washington Correspondent Jonathan Karl ...,2024-01-26 05:19:44.172346
/watch?v=9fzDXpsixi4&pp=ygUbcHJlc2lkZW50aWFsIGVsZWN0aW9uIHRydW1w,/@aljazeeraenglish,Al Jazeera English,2024 US presidential election: Biden and Trump favourites to face each other,31K,3 weeks,"The 2024 US Presidential election is starting to look a lot like 2020 – a rematch between former President Donald Trump, and ...",2024-01-26 05:19:44.176135
/shorts/ytzeV3g4Gyk,/@NBCNews,NBC News,"#Voters sour on #Trump, #Biden rematch in #2024, poll finds",125K,9 months,"NBC News Political Director and Moderator of ""Meet the Press"" breaks down the latest NBC News national poll. » Subscribe to ...",2024-01-26 05:19:44.179167
/watch?v=Ky4BUvIO3JQ&pp=ygUbcHJlc2lkZW50aWFsIGVsZWN0aW9uIHRydW1w,/@POLITICO,POLITICO,"DeSantis ends 2024 presidential campaign, endorses Trump",41K,4 days,Gov. Ron DeSantis ended his turbulent campaign Sunday after he was unable to convince Republicans to set aside their ...,2024-01-26 05:19:44.181005
/watch?v=GhyG4VhYGKw&pp=ygUbcHJlc2lkZW50aWFsIGVsZWN0aW9uIHRydW1w,/@WTVRCBS6,WTVR CBS 6,Supreme Court will decide if Donald Trump can be kept off 2024 presidential ballots,141K,2 weeks,The Supreme Court will decide whether former President Donald Trump can be kept off the 2024 presidential ballot because of ...,2024-01-26 05:19:44.182815
/shorts/6kz1fd8v9Xs,/@TheNationalUAEchannel,The National News,Trump doubles down that he won the 2020 election,2.7M,3 years,"President Donald Trump has again made claims of mass voter fraud in the US presidential election without evidence, doubling ...",2024-01-26 05:19:44.184637
/watch?v=mfI-7rGklVE&pp=ygUbcHJlc2lkZW50aWFsIGVsZWN0aW9uIHRydW1w,/@ForbesBreakingNews,Forbes Breaking News,WATCH: Trump Reacts To Mike Pence Dropping Out Of 2024 Presidential Race,388K,2 months,"At a campaign event last night in Las Vegas, Nevada, former President Trump responded to his former Vice President Mike Pence ...",2024-01-26 05:19:44.186103
/watch?v=U_pBtjw2Duw&pp=ygUbcHJlc2lkZW50aWFsIGVsZWN0aW9uIHRydW1w,/@fox26houston,FOX 26 Houston,"2024 Election: Republican presidential candidates campaign in Iowa, Trump not present",25K,2 weeks,"Republican Presidential candidates hoping to unseat president Biden are in Iowa trying to persuade undecided voters, but ...",2024-01-26 05:19:44.187704
/watch?v=6nO5B5Ci98o&pp=ygUbcHJlc2lkZW50aWFsIGVsZWN0aW9uIHRydW1w,/@ForbesBreakingNews,Forbes Breaking News,Trump: 'I Make You This Promise' If I Win In 2024,700K,2 months,"At the Florida Freedom Summit yesterday in Kissimmee, Florida, former President Trump spoke about his plans should he win in ...",2024-01-26 05:19:44.189214
/watch?v=gwaLJ0SgXw8&pp=ygUbcHJlc2lkZW50aWFsIGVsZWN0aW9uIHRydW1w,/@WION,WION,"US Elections: Trump wins New Hampshire Republican primary, Nikki Haley pledges to continue campaign",7K,1 day,"Former President Donald Trump won the New Hampshire primary, dealing a blow to his only remaining major rival Nikki Haley ...",2024-01-26 05:19:44.190736
/watch?v=OZS6ycf2Q6A&pp=ygUbcHJlc2lkZW50aWFsIGVsZWN0aW9uIHRydW1w,/@CNN,CNN,"Trump wins Wisconsin, closes in on 270 electoral votes",2.6M,7 years,"CNN projects that Donald Trump will win Wisconsin, putting him just 14 electoral votes away from winning the presidency.",2024-01-26 05:19:44.192307
/watch?v=muhrghfODOg&pp=ygUbcHJlc2lkZW50aWFsIGVsZWN0aW9uIHRydW1w,/@CNN,CNN,Donald Trump elected president,442K,7 years,CNN projects Donald Trump has been elected president of the United States of America.,2024-01-26 05:19:44.194094
/shorts/40jDchx1-KU,/@msnbc,MSNBC,Judge Judy: Hold your nose if it's Trump vs. Biden,324K,3 days,Judge Judy Sheindlin sat down with NBC News' Ali Vitali after endorsing Nikki Haley's presidential bid. The renowned TV judge ...,2024-01-26 05:19:44.195518
/watch?v=MXQG3hwxiso&pp=ygUbcHJlc2lkZW50aWFsIGVsZWN0aW9uIHRydW1w,/@WION,WION,"US Presidential Election: Trump escalates attack on Haley, targets her in campaign | WION",4K,7 days,"Morning in courtroom and evening in rallies, this is how Republican front runner Donald Trump is spending his days.",2024-01-26 05:19:44.196887
/watch?v=R4C2zC9R5oo&pp=ygUbcHJlc2lkZW50aWFsIGVsZWN0aW9uIHRydW1w,/@Foxla,FOX 11 Los Angeles,Trump fighting to stay in Colorado ballot for 2024 Presidential Election,66K,3 weeks,Former President Donald Trump is making his appeal in hopes of remaining on the Colorado ballot for the 2024 election.,2024-01-26 05:19:44.198373
/watch?v=J53aH2zEpDA&pp=ygUbcHJlc2lkZW50aWFsIGVsZWN0aW9uIHRydW1w,/@fox35,FOX 35 Orlando,"Gov. Ron DeSantis drops out of presidential race, he's now endorsing Donald Trump",43K,4 days,"In a video posted to X, formerly known as Twitter, Florida Governor Ron DeSantis announced he was dropping out of the ...",2024-01-26 05:19:44.199680
/watch?v=tamGyKdsegI&pp=ygUbcHJlc2lkZW50aWFsIGVsZWN0aW9uIHRydW1w,/@scrippsnews,Scripps News,Donald Trump wins New Hampshire's GOP primary,49K,2 days,Former President Donald Trump wins the GOP presidential primary in New Hampshire. The victory marks his second of the ...,2024-01-26 05:19:44.201069
/watch?v=Dy2-0ha9hTs&pp=ygUbcHJlc2lkZW50aWFsIGVsZWN0aW9uIHRydW1w,/@Foxla,FOX 11 Los Angeles,Donald Trump wins 2024 Iowa Caucus: AP,34K,10 days,"The Associated Press has reported that former President Donald Trump has won the 2024 Iowa Caucus, with second place still up ...",2024-01-26 05:19:44.202521
/watch?v=GvO2PIwvjew&pp=ygUbcHJlc2lkZW50aWFsIGVsZWN0aW9uIHRydW1w,/@GlennKirschner2,Glenn Kirschner,Nikki Haley might stay in the race because Donald Trump might be kicked off the presidential ballot,291K,1 day,Nikki Haley has now lost in Iowa and New Hampshire. But don't expect her to drop out of the race for the Republican nomination.,2024-01-26 05:19:44.203967
/watch?v=q1o32rwRcQ8&pp=ygUbcHJlc2lkZW50aWFsIGVsZWN0aW9uIHRydW1w,/@wsj,The Wall Street Journal,New Hampshire Primary: Nikki Haley’s Last Chance to Beat Donald Trump? | WSJ,111K,3 days,The New Hampshire GOP primary is now a one-on-one battle between former South Carolina Gov. Nikki Haley and former ...,2024-01-26 05:19:44.205788
/watch?v=605V5Y-l6l4&pp=ygUbcHJlc2lkZW50aWFsIGVsZWN0aW9uIHRydW1w,/@WION,WION,"US Presidential Elections 2024: Nikki Haley closes in, 4% behind Donald Trump | WION",35K,1 month,The US Presidential race is heating up. Republican presidential candidate Nikki Haley is catching up to former US President ...,2024-01-26 05:19:52.158127
/watch?v=4PHfQpfFUyg&pp=ygUbcHJlc2lkZW50aWFsIGVsZWN0aW9uIHRydW1w,/@cnnnews18,CNN-News18,U.S. Presidential Election 2024 | Donald Trump Vs Nikki Haley In New Hampshire | World | News18,2.7K,2 days,U.S. Presidential Election 2024 | Donald Trump Vs Nikki Haley In New Hampshire | World | News18 U.S. President | It is going to ...,2024-01-26 05:19:52.166132
/watch?v=0e8NHXuqx94&pp=ygUbcHJlc2lkZW50aWFsIGVsZWN0aW9uIHRydW1w,/@Foxla,FOX 11 Los Angeles,"2024 Election: Trump dominates early, polls show",24K,6 months,The latest poll numbers indicate Donald Trump is dominating early in GOP primary states. Subscribe to FOX 11 on YouTube: ...,2024-01-26 05:19:52.175760
/watch?v=i8kjoK8XZyk&pp=ygUbcHJlc2lkZW50aWFsIGVsZWN0aW9uIHRydW1w,/@globalnews,Global News,Americans don’t want Trump-Biden rematch for 2024 US presidential elections: poll,18K,1 month,A new U.S. poll shows few Americans want to see a rematch of former president Donald Trump and President Joe Biden in the ...,2024-01-26 05:19:52.179101
/watch?v=qUip9BnHx18&pp=ygUbcHJlc2lkZW50aWFsIGVsZWN0aW9uIHRydW1w,/@CNN,CNN,Are those most opposed to Trump aiding his election?,111K,5 days,"With time running out, many institutional forces are trying to stop Trump. But, asks CNN's Michael Smerconish, are their efforts ...",2024-01-26 05:19:52.181641
/watch?v=w6L2K-VHkiM&pp=ygUbcHJlc2lkZW50aWFsIGVsZWN0aW9uIHRydW1w,/@CSPAN,C-SPAN,"Former President Donald Trump in Iowa: ""Even if you vote and then pass away, it's worth it.""",70K,11 days,C-SPAN: Created by Cable in 1979. Offered as a public service. Support C-SPAN by Donating Today: ...,2024-01-26 05:19:52.183617
/watch?v=0rBsnCsvxm4&pp=ygUbcHJlc2lkZW50aWFsIGVsZWN0aW9uIHRydW1w,/@WION,WION,US Presidential Elections 2024: Nikki Haley Vs Donald Trump | WION,9.1K,1 month,The US Presidential race is heating up. Republican presidential candidate Nikki Haley is catching up to former US President ...,2024-01-26 05:19:52.185708
/watch?v=HMTSR-_xoCM&pp=ygUbcHJlc2lkZW50aWFsIGVsZWN0aW9uIHRydW1w,/@msnbc,MSNBC,Trump issues most chilling claim yet ahead of 2024 election,349K,13 days,"On the heels of his latest court appearance, Donald Trump is making his most chilling claim yet: That presidents should have total ...",2024-01-26 05:19:52.191307
/watch?v=iwiwW28_eYc&pp=ygUbcHJlc2lkZW50aWFsIGVsZWN0aW9uIHRydW1w,/@livenowfox,LiveNOW from FOX,"DeSantis drops out, endorses Trump days before New Hampshire primary | LiveNOW from FOX",58K,4 days,Florida Gov. Ron DeSantis is ending his 2024 Republican presidential campaign after failing to overtake rival Donald Trump in ...,2024-01-26 05:19:52.194657
/watch?v=lRuFvGTIL38&pp=ygUbcHJlc2lkZW50aWFsIGVsZWN0aW9uIHRydW1w,/@FoxNews,Fox News,Trump campaign team member reveals what he is looking for in his VP pick,316K,3 days,Trump campaign press secretary Karoline Leavitt joins 'Jesse Watters Primetime' to discuss the former president's potential ...,2024-01-26 05:19:52.198445
/watch?v=_oWIWMYz7lA&pp=ygUbcHJlc2lkZW50aWFsIGVsZWN0aW9uIHRydW1w,/@FoxNews,Fox News,Former President Trump calls for unity in victory speech at Iowa caucuses,868K,Streamed 10 days,Former President Trump delivers a victory speech at Iowa caucuses. Subscribe to Fox News! https://bit.ly/2vBUvAS Watch more ...,2024-01-26 05:19:52.202361
/watch?v=WsIIcxon6PU&pp=ygUbcHJlc2lkZW50aWFsIGVsZWN0aW9uIHRydW1w,/@CBSNews,CBS News,"Trump, Haley, voters react to DeSantis dropping out of 2024 presidential race",23K,3 days,"Ron DeSantis announced he was suspending his presidential campaign over the weekend, leaving Donald Trump and Nikki ...",2024-01-26 05:19:52.207608
/watch?v=djT5HHcTk10&pp=ygUbcHJlc2lkZW50aWFsIGVsZWN0aW9uIHRydW1w,/@CNN,CNN,Ron DeSantis ends his 2024 presidential campaign,465K,4 days,Florida Gov. Ron DeSantis announces he is ending his 2024 presidential bid in a video posted to X. The announcement comes ...,2024-01-26 05:19:52.210953
/watch?v=kXSy3XyF-eA&pp=ygUbcHJlc2lkZW50aWFsIGVsZWN0aW9uIHRydW1w,/@TheTimes,The Times and The Sunday Times,LIVE: Donald Trump victory speech in New Hampshire primary,71K,Streamed 2 days,"The Donald J. Trump for President Campaign hosts an election night watch party in Nashua, New Hampshire. Today's turnout for ...",2024-01-26 05:19:52.214687
/shorts/uK7z4kcI5qw,/@msnbc,MSNBC,Katie Phang: #Trump stole the 2016 #election,7M,9 months,MSNBC's Katie Phang breaks down why she believes Donald Trump stole the 2016 presidential election. » Subscribe to MSNBC: ...,2024-01-26 05:19:52.226198
/watch?v=Zn9MIuXoYtI&pp=ygUbcHJlc2lkZW50aWFsIGVsZWN0aW9uIHRydW1w,/@fallontonight,The Tonight Show Starring Jimmy Fallon,"Trump Confuses Nikki Haley with Nancy Pelosi, DeSantis Drops Out of Presidential Race | Tonight Show",213K,3 days,"Jimmy addresses the latest news, like Ron DeSantis announcing the end of his presidential campaign, Nikki Haley questioning ...",2024-01-26 05:19:52.231313
/watch?v=ohNgz_0PhRk&pp=ygUbcHJlc2lkZW50aWFsIGVsZWN0aW9uIHRydW1w,/@livenowfox,LiveNOW from FOX,Trump 2024: Historian predicts Donald Trump returns to White House | LiveNOW from FOX,141K,8 months,Historian and Hoover Institution senior fellow Niall Ferguson argued that former President Donald Trump is not only a strong ...,2024-01-26 05:19:52.243877
/shorts/jdu2Vt5JdAo,/@washingtonpostshorts,Washington Post Shorts,Will this county predict the next U.S. president?,2.7M,7 months,Who will win in 2024? Some experts are looking to one county in Wisconsin that has backed the presidential winner in every ...,2024-01-26 05:19:52.258437
/shorts/BVp64s4wTXM,/@CNN,CNN,Collins presses Trump on false election claims,3.9M,8 months,Former President Trump refused to concede the 2020 election and repeated false claims when pressed by CNN's Kaitlan Collins.,2024-01-26 05:19:52.262462
/watch?v=g1CqMmMApbM&pp=ygUbcHJlc2lkZW50aWFsIGVsZWN0aW9uIHRydW1w,/@SkyNewsAustralia,Sky News Australia,Donald Trump stands ‘very good chance’ at 2024 election,7.8K,5 days,Political commentator Shemeka Michelle says Donald Trump has a “very good chance” of taking the White House despite the list ...,2024-01-26 05:19:52.271309
